Course_Name,Rating,No_of_Ratings,No_of_Enrollment,Duration,Institution,Subject,Level,Language,Price
BabsonX: Financial Accounting Made Fun: Eliminating Your Fears,4.5stars,28 ratings,54692,4,BabsonX,Business & Management,Introductory,English,20916
HECMontrealX: UX Design,None,None,33308,6,HECMontrealX,Design,Intermediate,English,30939
URosarioX: Finanzas e inversiones para no financieros,None,None,5626,4,URosarioX,Economics & Finance,Introductory,Español,3276
TUMx: Academic Writing Made Easy,None,None,64802,8,TUMx,Language,Intermediate,English,4947
HarvardX: Practical Improvement Science in Health Care: A Roadmap for Getting Results,4.9,12 ratings,19463,7,HarvardX,Business & Management,Introductory,English,20878
GalileoX: Transformando la educación con IA: ChatGPT,4.7stars,37 ratings,12359,4,GalileoX,Education & Teacher Training,Introductory,Español,2436
"HarvardX: Women Making History: Ten Objects, Many Stories",4.6,22 ratings,69014,8,HarvardX,History,Introductory,English,17524
IBM: Data Science Tools,4.4,42 ratings,34926,7,IBM,Data Analysis & Statistics,Introductory,English,8301
ArmEducationX: Computer Architecture Essentials on Arm,4.2,9 ratings,None,6,ArmEducationX,Computer Science,Intermediate,English,8301
UQx: Academic English: How to Write a Thesis,4.8,8 ratings,6854,10,UQx,Education & Teacher Training,Introductory,English,10816
"UMD, USMx: The Industry and Profession in Construction Management",4.6,30 ratings,7995,4,UMD,Engineering,Intermediate,English,20878
AnahuacX: Marketing Digital: Desde SEO hasta Analítica de Datos,3.6,5 ratings,None,5,AnahuacX,Business & Management,Introductory,Español,4108
RITx: Visual Presentation,4.6,24 ratings,13549,3,RITx,Communication,Introductory,English,16685
NUS: Circuits for Beginners,4.6stars,15 ratings,10529,6,NUS,Engineering,Introductory,English,11676
EC-Council: Digital Forensics Essentials (DFE),4.7,13 ratings,None,1,EC-Council,Computer Science,Intermediate,English,10816
"HarvardX: Principles, Statistical and Computational Tools for Reproducible Data Science",4.1,11 ratings,108207,8,HarvardX,Data Analysis & Statistics,Intermediate,English,12493
IIMBx: Advanced Corporate Strategy,4.5,8 ratings,8158,5,IIMBx,Business & Management,Advanced,English,15847
RedHat: Fundamentals of Red Hat Enterprise Linux 9,4.7stars,23 ratings,76201,8,RedHat,Computer Science,Introductory,English,8316
"DartmouthX, IMTx: C Programming: Language Foundations",4.6,15 ratings,70359,5,DartmouthX,Computer Science,Introductory,English,8301
TecdeMonterreyX: Introducción a Matemáticas para Finanzas y Negocios,None,None,22375,5,TecdeMonterreyX,Economics & Finance,Advanced,Español,4947
MITx: Cell Biology: Transport and Signaling,5,7 ratings,11778,6,MITx,Biology & Life Sciences,Advanced,English,8301
SmithsonianX: Teaching Critical Thinking through Art with the National Gallery of Art,4.9stars,29 ratings,34233,16,SmithsonianX,Education & Teacher Training,Introductory,English,9996
EPFLx: Introduction to Astrophysics,3.8,8 ratings,42431,7,EPFLx,Physics,Introductory,English,15008
"ImperialX: A-level Further Mathematics for Year 13 - Course 1: Differential Equations, Further Integration, Curve Sketching, Complex Numbers, the Vector Product and Further Matrices",4.8,5 ratings,None,7,ImperialX,Math,Intermediate,English,5785
WellesleyX: Italian Language and Culture: Advanced (2023-2024),4.7stars,47 ratings,40768,12,WellesleyX,Language,Advanced,Italiano,4956
IMFx: Public Financial Management,4.8,66 ratings,43869,8,IMFx,Economics & Finance,Intermediate,English,2096
IIMBx: Macroeconomics: Theory and Policy,4.3,21 ratings,None,6,IIMBx,Economics & Finance,Intermediate,English,15847
BabsonX: Financial Analysis for Decision Making,4.6stars,21 ratings,51941,4,BabsonX,Business & Management,Introductory,English,20916
IUx: Developing Your Personal Leadership Style,4.4,20 ratings,6175,4,IUx,Business & Management,Introductory,English,16685
UPValenciaX: Basic Spanish 3: Getting there,4.4,42 ratings,40068,4,UPValenciaX,Language,Introductory,English,3270
HarvardX: The Opioid Crisis in America,4.8,26 ratings,76188,10,HarvardX,Medicine,Introductory,English,12493
IBM: Deep Learning with Tensorflow,4.4,14 ratings,52938,5,IBM,Data Analysis & Statistics,Intermediate,English,8301
PennX: Intellectual Property Law and Policy: Part 1,4.4stars,14 ratings,62458,6,PennX,Law,Intermediate,English,14196
IIMBx: New Product Development,None,None,16916,6,IIMBx,Business & Management,Introductory,English,15847
"AWS: DevOps on AWS: Code, Build, and Test",4.3,17 ratings,7613,2,AWS,Computer Science,Intermediate,English,4947
AnahuacX: Psicología Criminal,4.7,11 ratings,None,4,AnahuacX,Social Sciences,Introductory,Español,4108
UAMx: Introducción al desarrollo de aplicaciones web,3.5,5 ratings,63567,5,UAMx,Computer Science,Introductory,Español,2432
AdelaideX: Risk Management for Projects,4.6stars,75 ratings,37938,5,AdelaideX,Business & Management,Introductory,English,20916
"AnahuacX: Inglés empresarial: ventas, gestión y liderazgo",4.8,14 ratings,41083,4,AnahuacX,Business & Management,Introductory,Español,3270
MITx: Quantitative Biology Workshop,4.3,8 ratings,27413,9,MITx,Biology & Life Sciences,Intermediate,English,8301
DelftX: Sustainable Energy: Design a Renewable Future,4.2,22 ratings,40290,9,DelftX,Engineering,Intermediate,English,5198
HKUx: Introduction to FinTech,4.6,38 ratings,118905,6,HKUx,Economics & Finance,Introductory,English,16685
DelftX: Industrial Biotechnology,4.6stars,9 ratings,20603,7,DelftX,Engineering,Intermediate,English,12516
GTx: Computing in Python II: Control Structures,4.8,36 ratings,53281,5,GTx,Computer Science,Introductory,English,15847
AnahuacX: Inteligencia emocional para el liderazgo efectivo y colaboración,4.4,33 ratings,46464,4,AnahuacX,Social Sciences,Introductory,Español,3270
EPFLx: IoT Systems and Industrial Applications with Design Thinking,4.4,22 ratings,None,7,EPFLx,Engineering,Intermediate,English,14170
RITx: Data Representation and Visualization in Tableau,4.1,17 ratings,16194,4,RITx,Data Analysis & Statistics,Intermediate,English,20878
LinuxFoundationX: Introduction to Jenkins,4.1,9 ratings,24500,12,LinuxFoundationX,Computer Science,Introductory,English,15847
UPValenciaX: Upper-Intermediate English: Business and Globalization,4.8,11 ratings,82476,4,UPValenciaX,Language,Intermediate,English,3270
DelftX: Solar Energy: Photovoltaic (PV) Systems,4.8,5 ratings,36923,11,DelftX,Engineering,Advanced,English,20961
HarvardX: MalariaX: Defeating Malaria from the Genes to the Globe,4.6,14 ratings,10834,11,HarvardX,Biology & Life Sciences,Intermediate,English,None
HarvardX: Religious Literacy: Traditions and Scriptures,4.6,33 ratings,118302,4,HarvardX,Humanities,Introductory,English,12493
IBM: Models and Platforms for Generative AI,4.6,5 ratings,None,3,IBM,Computer Science,Introductory,English,4108
DelftX: Electric Cars: Introduction,4.4,37 ratings,81477,4,DelftX,Engineering,Intermediate,English,10397
TUMx: Lean Production,4.7,80 ratings,75614,6,TUMx,Business & Management,Introductory,English,15847
MITx: Cell Biology: The Cytoskeleton and Cell Cycle,None,None,6348,7,MITx,Biology & Life Sciences,Advanced,English,8301
UPValenciaX: Fundamentos del marketing digital,4.3,18 ratings,11944,3,UPValenciaX,Business & Management,Introductory,Español,3773
TecdeMonterreyX: ChatGPT - Usos y Estrategias,None,None,None,4,TecdeMonterreyX,Computer Science,Introductory,Español,4200
RITx: Design Thinking Fundamentals,4.5,9 ratings,79976,6,RITx,Business & Management,Intermediate,English,28256
AdelaideX: Maths Foundations,None,None,None,4,AdelaideX,Math,Introductory,English,8316
Codio: Python Programming: Intermediate Concepts,4.6,17 ratings,None,5,Codio,Computer Science,Introductory,English,15847
"PortugalX, UNL: Academia de Empreendedorismo",None,None,None,7,UNL,Business & Management,Introductory,Português,4612
"UPValenciaX, GalileoX: Herramientas de Inteligencia Artificial para la productividad. Más allá del ChatGPT",None,None,None,4,UPValenciaX,Engineering,Intermediate,Español,4108
DoaneX: Abnormal Psychology,4.6stars,8 ratings,11242,8,DoaneX,Humanities,Intermediate,English,9996
HarvardX: Entropy and Equilibria,4.3,6 ratings,5580,10,HarvardX,Chemistry,Introductory,English,20878
URosarioX: Introducción a las finanzas: Principios de valoración,None,None,35704,4,URosarioX,Economics & Finance,Intermediate,Español,1593
"UMES, USMx: Introduction to Hospitality and Tourism Industry",4.5stars,34 ratings,22247,6,UMES,Business & Management,Introductory,English,4116
StanfordOnline: Your Body Inside and Out: Using Exercise Physiology to Slow Aging,4.8,15 ratings,9286,8,StanfordOnline,Biology & Life Sciences,Introductory,English,5785
HKUSTx: Digital Design,None,None,29878,5,HKUSTx,Design,Introductory,English,4947
URosarioX: Introducción a la ciberseguridad,None,None,15346,4,URosarioX,Computer Science,Intermediate,Español,4116
NYIF: Risk Management Tools and Practices,4.5,63 ratings,None,4,NYIF,Economics & Finance,Intermediate,English,None
WellesleyX: AP® Italian Language and Culture (2024-2025),4.6,8 ratings,None,12,WellesleyX,Humanities,Advanced,Italiano,4947
AlaskaX: The Resilient and Renewable Grid: How Microgrids are Revolutionizing Energy Systems,4.3stars,35 ratings,None,4,AlaskaX,Engineering,Introductory,English,20916
WageningenX: Nutrition and Cancer,4.7,41 ratings,44218,5,WageningenX,Food & Nutrition,Intermediate,English,15847
TecdeMonterreyX: Pensamiento crítico: toma de decisiones razonadas,None,None,29780,4,TecdeMonterreyX,Business & Management,Introductory,Español,15847
UPValenciaX: Introducción a la inversión bursátil,4.2stars,20 ratings,103260,2,UPValenciaX,Economics & Finance,Introductory,Español,3276
Google: Power Searching with Google,4.6,9 ratings,27222,3,Google,Computer Science,Introductory,English,18362
AnahuacX: Comunicación y Redacción Digital,4.7,11 ratings,30070,4,AnahuacX,Communication,Introductory,Español,1593
TUMx: Biotech — From Science to Business,4.8stars,15 ratings,None,4,TUMx,Business & Management,Introductory,English,12516
"EdinburghX: Data Ethics, AI and Responsible Innovation",4.4,13 ratings,13116,5,EdinburghX,Computer Science,Intermediate,English,4947
GTx: Computing in Python III: Data Structures,4.4,29 ratings,45413,5,GTx,Computer Science,Introductory,English,15847
AnahuacX: Introducción a la inteligencia emocional,4.8,27 ratings,40402,4,AnahuacX,Social Sciences,Introductory,Español,3270
UNCordobaX: Marketing enfocado en la estrategia de servicios,4.4stars,5 ratings,42420,6,UNCordobaX,Business & Management,Introductory,Español,9156
TecdeMonterreyX: Inteligencia Artificial para negocios,4.2,5 ratings,None,5,TecdeMonterreyX,Computer Science,Intermediate,Español,10816
IUx: Effective Management and Communication,4.6,48 ratings,None,4,IUx,Business & Management,Introductory,English,16685
UCx: A Better Start to Reading,4.7stars,10 ratings,13441,6,UCx,Education & Teacher Training,Introductory,English,15876
IBM: Networking and Storage Essentials,4.5,11 ratings,None,4,IBM,Computer Science,Introductory,English,4108
RaspberryPiFoundation: Getting Started with Your Raspberry Pi,4.4,9 ratings,None,3,RaspberryPiFoundation,Education & Teacher Training,Introductory,English,4947
AnahuacX: Preparación de alimentos saludables,None,None,None,5,AnahuacX,Food & Nutrition,Introductory,Español,1593
Codio: C++ Programming: Object-Oriented Design,None,None,None,5,Codio,Computer Science,Introductory,English,15847
AWS: Introduction to Machine Learning on AWS,4.5,12 ratings,None,2,AWS,Computer Science,Introductory,English,4947
HKUSTx: Big Data Computing with Spark,None,None,None,8,HKUSTx,Computer Science,Intermediate,English,31778
UCSanDiegoX: Data Structures Fundamentals,None,None,54432,6,UCSanDiegoX,Computer Science,Intermediate,English,12577
LSE: An Introduction to Pre-University Mathematics,None,None,None,6,LSE,Math,Introductory,English,16716
RaspberryPiFoundation: An Introduction to Web Development,4.5,8 ratings,None,3,RaspberryPiFoundation,Education & Teacher Training,Intermediate,English,4947
WOBI: How to Influence the Consumer Behavior to Drive Sales by Jonah Berger,4.3,18 ratings,None,2,WOBI,Business & Management,Intermediate,English,25908
ETHx: Self-Driving Cars with Duckietown,None,None,12288,9,ETHx,Computer Science,Introductory,English,4192
"UMD, USMx: Sustainable Construction Management",4.6,31 ratings,5575,4,UMD,Engineering,Intermediate,English,20878
DelftX: Façade design and engineering: complexity made simple,4.6,34 ratings,7335,6,DelftX,Architecture,Introductory,English,11655
ImperialX: Incorporating Renewable Energy in Electricity Grids,4.6stars,37 ratings,20429,6,ImperialX,Energy & Earth Sciences,Intermediate,English,4956
WestonHS: On-Ramp to AP® French Language and Culture,None,None,114745,3,WestonHS,Humanities,Advanced,Français,2432
Codio: Python Programming: Object-Oriented Design,4.7stars,12 ratings,None,5,Codio,Computer Science,Introductory,English,15876
IBM: PyTorch Basics for Machine Learning,3.5,22 ratings,15228,5,IBM,Data Analysis & Statistics,Introductory,English,3270
IBM: Developing Generative AI Applications with Python,None,None,None,6,IBM,Computer Science,Intermediate,English,8301
IBM: Soft Skills: Collaborate Effectively,4.6,6 ratings,None,1,IBM,Communication,Introductory,English,2432
UPValenciaX: Physics Fundamentals: Electromagnetics,4.5,27 ratings,None,7,UPValenciaX,Physics,Introductory,English,2432
IBM: Soft Skills: Present with Purpose,4.4,24 ratings,None,1,IBM,Communication,Introductory,English,2432
GTx: Computing in Python IV: Objects & Algorithms,4.7stars,29 ratings,46635,5,GTx,Computer Science,Introductory,English,15876
HKUSTx: Data Mining and Knowledge Discovery,4.8,5 ratings,None,8,HKUSTx,Computer Science,Intermediate,English,36808
edX: Intro Course: Spreadsheets and Statistics,4.5,6 ratings,None,4,edX,Data Analysis & Statistics,Introductory,English,8301
UPValenciaX: Introducción a SQL y bases de datos relacionales,4.5,24 ratings,13206,5,UPValenciaX,Computer Science,Introductory,Español,3270
UTokyoX: Basic Analytical Chemistry,3.4,6 ratings,35598,6,UTokyoX,Chemistry,Introductory,English,4947
NUS: Semiconductors for Beginners,4.8,13 ratings,5554,3,NUS,Engineering,Introductory,English,11655
ImperialX: Creative Thinking: Techniques and Tools for Success,4.4,47 ratings,80107,7,ImperialX,Humanities,Introductory,English,4947
BabsonX: The Entrepreneurial Mindset,4.3,17 ratings,42752,6,BabsonX,Business & Management,Introductory,English,15847
ETHx: Autonomous Mobile Robots,4.6,7 ratings,73184,15,ETHx,Computer Science,Intermediate,English,4192
RITx: Network Security,4.8stars,10 ratings,69946,8,RITx,Computer Science,Advanced,English,33516
LCIEducation: Introduction to Psychological Aspects of Game Design,None,None,None,5,LCIEducation,Computer Science,Introductory,English,15008
"KULeuvenX: European History, Society and Culture",4.5,25 ratings,None,8,KULeuvenX,History,Intermediate,English,4947
RITx: Business Communication,4.5,35 ratings,17232,3,RITx,Communication,Introductory,English,16685
MITx: Genetics: Analysis and Applications,5,12 ratings,None,8,MITx,Biology & Life Sciences,Advanced,English,8301
IDBx: Líderes para la gestión en seguridad ciudadana y justicia,4.8stars,31 ratings,None,10,IDBx,Social Sciences,Intermediate,Español,2100
JaverianaX: Gerencia estratégica: bases y principios,4.7,13 ratings,7294,4,JaverianaX,Business & Management,Introductory,Español,3773
CatalystX: Becoming a Successful Leader (Inclusive Leadership Training),4.6,138 ratings,235283,4,CatalystX,Communication,Introductory,English,5785
BerkeleyX: Finding Purpose Across Your Life,None,None,None,6,BerkeleyX,Social Sciences,Introductory,English,12493
UPValenciaX: FlashDiet: Aprende a comer sano,None,None,80791,5,UPValenciaX,Food & Nutrition,Introductory,Español,3270
TecdeMonterreyX: Visualización de Datos y Storytelling,4.2,10 ratings,18147,4,TecdeMonterreyX,Data Analysis & Statistics,Intermediate,Español,4947
IBM: Data Warehousing and BI Analytics,4.4stars,19 ratings,6142,6,IBM,Computer Science,Intermediate,English,8316
UCSanDiegoX: Computer Graphics,None,None,119028,6,UCSanDiegoX,Computer Science,Intermediate,English,8301
MITx: Molecular Biology - Part 2: Transcription and Transposition,None,None,27985,7,MITx,Biology & Life Sciences,Advanced,English,8301
"UMD, USMx: Managing Conflicts on Projects with Cultural and Emotional Intelligence",4.7,59 ratings,14702,5,UMD,Business & Management,Introductory,English,20878
StanfordOnline: Reservoir Geomechanics,4.9stars,19 ratings,17783,10,StanfordOnline,Energy & Earth Sciences,Introductory,English,13356
UniversityofCambridge: Foundations of Corporate Finance,4.6,19 ratings,5422,5,UniversityofCambridge,Economics & Finance,Intermediate,English,25070
TokyoTechX: Introduction to Electrical and Electronic Engineering - 電気電子工学入門 -,4.3,8 ratings,36465,4,TokyoTechX,Engineering,Introductory,English,10816
SmithsonianX: Teaching Complex Thinking through Art with the National Gallery of Art,5,6 ratings,None,16,SmithsonianX,Education & Teacher Training,Introductory,English,9978
IBM: Guided Project: Web Development w/ HTML & CSS for Beginners,None,None,None,1,IBM,Computer Science,Introductory,English,41916
IDBx: Gestion de projets de développement,4.5,41 ratings,63508,10,IDBx,Business & Management,Intermediate,Français,2096
URosarioX: A travel by Spanish America: Spanish for beginners,None,None,28933,4,URosarioX,Language,Introductory,Español,3270
"EIT_Food: Food for Thought: The Relationship Between Food, Gut and Brain",4.8,5 ratings,None,5,EIT_Food,Food & Nutrition,Intermediate,English,10816
CornellX: Teaching & Learning in the Diverse Classroom,4.6stars,36 ratings,21077,5,CornellX,Education & Teacher Training,Introductory,English,8316
RaspberryPiFoundation: Introduction to Encryption and Cryptography,4.5,5 ratings,None,2,RaspberryPiFoundation,Education & Teacher Training,Intermediate,English,4947
"UMD, USMx: Let’s Get Emotional:  Emotions & Emotional Intelligence!",4.3,19 ratings,9851,5,UMD,Business & Management,Introductory,English,20878
GalileoX: Unlocking the Power of Generative AI with ChatGPT for Higher Education,4.8,21 ratings,None,5,GalileoX,Education & Teacher Training,Introductory,English,3270
AI: Python and Pandas for Data Engineering,4.5,26 ratings,None,4,AI,Computer Science,Introductory,English,37647
ISCEA: Lean Six Sigma Program and Project Management,4.1,10 ratings,None,3,ISCEA,Business & Management,Introductory,English,20878
NYIF: Accounting System Structure and Information Management,4.5,33 ratings,8652,4,NYIF,Economics & Finance,Introductory,English,4192
AnahuacX: Fundamentos de información financiera y contable,4.7,11 ratings,17439,5,AnahuacX,Economics & Finance,Intermediate,Español,3270
"GTx: Data Structures & Algorithms II: Binary Trees, Heaps, SkipLists and HashMaps",4.9stars,12 ratings,8378,5,GTx,Computer Science,Intermediate,English,15876
LinuxFoundationX: Introduction to Open Source Networking Technologies,4.5,8 ratings,26438,14,LinuxFoundationX,Computer Science,Introductory,English,20878
HKUx: So You Want To Be A Surgeon?,4.9,8 ratings,18624,6,HKUx,Medicine,Introductory,English,8301
BabsonX: Rise to Leadership: Become a CEO,3.9,9 ratings,27337,4,BabsonX,Business & Management,Intermediate,English,20878
BerkleeX: Fundamentos de la guitarra eléctrica y acústica,4.8,5 ratings,26785,6,BerkleeX,Music,Introductory,Español,4947
URosarioX: Fisiología del ejercicio para todos,None,None,None,4,URosarioX,Medicine,Introductory,Español,3270
UniversityofCambridge: Digital Platforms in Performance,4.7,6 ratings,9846,4,UniversityofCambridge,Communication,Intermediate,English,25070
URosarioX: El cerebro y las emociones en el lenguaje,4.8stars,8 ratings,63668,5,URosarioX,Communication,Introductory,Español,4116
TecdeMonterreyX: Diseño e innovación de modelo de negocios,4.8,11 ratings,18776,4,TecdeMonterreyX,Business & Management,Advanced,Español,9978
CurtinX: Autism and Mental Health,4.9,16 ratings,None,4,CurtinX,Health & Safety,Introductory,English,8301
IBM: Python for Data Engineering Project,4.8,9 ratings,8469,1,IBM,Data Analysis & Statistics,Intermediate,English,2432
ASUx: Business Intelligence and Data Analytics,4.3stars,6 ratings,None,5,ASUx,Data Analysis & Statistics,Introductory,English,12516
DelftX: Probability Theory,None,None,None,6,DelftX,Math,Intermediate,English,12493
AWS: Introduction to AWS Cloud Careers,4.5,6 ratings,None,2,AWS,Computer Science,Introductory,English,9978
ASUx: Data Engineering,None,None,None,5,ASUx,Data Analysis & Statistics,Introductory,English,12516
AnahuacX: IA para docentes: Transforma tu enseñanza con ChatGPT,4.8,8 ratings,None,3,AnahuacX,Computer Science,Introductory,Español,3270
"UPValenciaX: Power BI para los negocios, herramientas de productividad",4.1,19 ratings,10289,5,UPValenciaX,Data Analysis & Statistics,Intermediate,Español,3270
IBM: Data Analytics and Visualization Capstone Project,4.5,12 ratings,5889,6,IBM,Data Analysis & Statistics,Introductory,English,12493
URosarioX: Matemáticas para la U,None,None,8190,4,URosarioX,Math,Introductory,Español,3270
"AdelaideX: Understanding Agribusiness, Value Chains, and Consumers in Global Food Systems",4.6stars,10 ratings,23819,4,AdelaideX,Business & Management,Intermediate,English,16716
AnahuacX: Ciencia de Datos Aplicada al Marketing,3.9,9 ratings,6677,5,AnahuacX,Data Analysis & Statistics,Introductory,Español,1593
UPValenciaX: Dynamics and Control,4.5stars,20 ratings,31361,6,UPValenciaX,Engineering,Introductory,English,3276
WBGx: e-Learning on Digital Agriculture,4.3,24 ratings,14952,5,WBGx,Environmental Studies,Introductory,English,419
URosarioX: Debate y argumentación,4.3,6 ratings,22907,4,URosarioX,Humanities,Introductory,Español,1593
AnahuacX: Mejora tu Negocio con Inteligencia Artificial,3.6,10 ratings,None,5,AnahuacX,Business & Management,Intermediate,Español,3270
EdinburghX: Nitrogen: A Global Challenge,4.5stars,54 ratings,6660,5,EdinburghX,Environmental Studies,Introductory,English,4956
NUS: Electricity Distribution,4.7,10 ratings,None,7,NUS,Engineering,Intermediate,English,11655
FedericaX: Applied anatomy of the locomotor system,4.4,10 ratings,17725,8,FedericaX,Medicine,Intermediate,English,4610
LinuxFoundationX: Introduction to Node.js,4.4,5 ratings,21641,7,LinuxFoundationX,Computer Science,Introductory,English,15847
RITx: Data Literacy Foundations,3.9,15 ratings,7512,4,RITx,Data Analysis & Statistics,Intermediate,English,20878
EPFLx: Cement Chemistry and Sustainable Cementitious Materials,4.0stars,14 ratings,10041,6,EPFLx,Physics,Intermediate,English,20916
"HKUSTx: Introduction to Semiconductors, PN Junctions and Bipolar Junction Transistors",4.7,9 ratings,17091,8,HKUSTx,Electronics,Intermediate,English,15847
NYIF: Risk Management and Credit Principles,4.4,18 ratings,18074,6,NYIF,Economics & Finance,Advanced,English,16685
MITx: Cell Biology: Cell-Cell Interactions,4.9,8 ratings,7090,7,MITx,Biology & Life Sciences,Advanced,English,8301
HP: The What and How of Esports Management!,4.0stars,28 ratings,None,4,HP,Computer Science,Introductory,English,420
edX: Intro Course: Data Storytelling,None,None,None,4,edX,Business & Management,Introductory,English,8301
HarvardX: Shakespeare's Hamlet: The Ghost,4.4,13 ratings,53860,4,HarvardX,Humanities,Introductory,English,12493
DavidsonX: Applied Storytelling,4.1stars,11 ratings,5713,4,DavidsonX,Communication,Introductory,English,10836
KULeuvenX: Clinical Nutrition – evidence-based practice,4.6,36 ratings,None,6,KULeuvenX,Food & Nutrition,Intermediate,English,4947
UPValenciaX: Introducción al Office 365,4.6,5 ratings,34690,7,UPValenciaX,Computer Science,Introductory,Español,5785
RITx: Project Management Life Cycle,4.5,51 ratings,141485,10,RITx,Business & Management,Intermediate,English,37647
"NYIF: Money Markets, Foreign Exchange and Time Value of Money",4.5,17 ratings,20955,4,NYIF,Economics & Finance,Introductory,English,16685
DelftX: Efficient HVAC Systems,4.8,11 ratings,12914,5,DelftX,Architecture,Intermediate,English,11655
UWashingtonX: Strategic Applications of IT Project & Program Management,4.7stars,21 ratings,27943,6,UWashingtonX,Business & Management,Introductory,English,20916
DelftX: Solar Energy: Photovoltaic (PV) Energy Conversion,4.6,8 ratings,55025,12,DelftX,Engineering,Advanced,English,20961
logycaX: Logistics Fundamentals,4.7,11 ratings,15245,5,logycaX,Engineering,Introductory,English,2096
WageningenX: Sustainable Soil Management: Soil for life,4.5stars,23 ratings,29206,7,WageningenX,Environmental Studies,Introductory,English,17556
LinuxFoundationX: Data and AI Fundamentals,4.2,11 ratings,None,10,LinuxFoundationX,Computer Science,Introductory,English,15847
DoaneX: Professional Business Presentations,None,None,14294,5,DoaneX,Communication,Introductory,English,16685
"DelftX, WageningenX: Sustainable Urban Development",4.7stars,20 ratings,56090,7,DelftX,Architecture,Introductory,English,11676
"IBM: Impact, Ethics, and Issues with Generative AI",4.6,9 ratings,None,3,IBM,Computer Science,Introductory,English,4108
FedericaX: Contemporary Issues in World Politics,4.2,14 ratings,19192,7,FedericaX,Social Sciences,Introductory,English,4107
UCR: Human Resources: Acquiring and Managing Talent in the 21st Century,4.8stars,23 ratings,None,8,UCR,Business & Management,Introductory,English,9996
DelftX: Calculus II: Multivariable Functions,None,None,None,6,DelftX,Math,Intermediate,English,12516
WBGx: Unlocking Investment and Finance in Emerging Markets and Developing Economies (EMDEs),4.7,42 ratings,39993,4,WBGx,Economics & Finance,Introductory,English,419
MandarinX: Mandarin Chinese Essentials,4.6,9 ratings,56768,5,MandarinX,Language,Introductory,English,15847
