Course_Name,Rating,No_of_Ratings,No_of_Enrollment,Duration,Institution,Subject,Level,Language,Price
WageningenX: Drones for Agriculture: Prepare and Design Your Drone (UAV) Mission,4.4stars,12 ratings,18381,3,WageningenX,Data Analysis & Statistics,Intermediate,English,17556
GTx: Introduction to Object-Oriented Programming with Java II: Object-Oriented Programming and Algorithms,3.5,13 ratings,9725,6,GTx,Computer Science,Introductory,English,20878
"DavidsonX: Innovate & Regulate: Drug Research, Costs, Clinical Trials & Approval",4.6,31 ratings,27548,5,DavidsonX,Medicine,Intermediate,English,9978
UniversityofCambridge: Stand Up!; Comedy Writing and Performance Poetry,5,7 ratings,12752,4,UniversityofCambridge,Communication,Intermediate,English,25070
TUMx: Make Your Own App,4.3,13 ratings,31391,7,TUMx,Computer Science,Introductory,English,6456
HarvardX: Judaism Through Its Scriptures,4.7,19 ratings,61347,4,HarvardX,Humanities,Introductory,English,12493
AlaskaX: Behavioral Neuroscience: Foundations of Compulsive Behaviors,None,None,None,5,AlaskaX,Biology & Life Sciences,Introductory,English,15847
HarvardX: First Nights - Beethoven's 9th Symphony and the 19th Century Orchestra,4.9stars,9 ratings,48554,3,HarvardX,Humanities,Introductory,English,12516
UBCx: AI for Teachers,4.5,21 ratings,None,3,UBCx,Computer Science,Introductory,English,1258
GTx: Human-Computer Interaction I: Fundamentals & Design Principles,4.7,10 ratings,19650,6,GTx,Computer Science,Introductory,English,9978
IMFx: VITARA - Compliance Risk Management,4.5,19 ratings,None,1,IMFx,Economics & Finance,Introductory,English,2096
IBM: Microservices and Serverless,4.3,7 ratings,None,2,IBM,Computer Science,Intermediate,English,8301
HECMontrealX: La gestion des ressources humaines,4.4,19 ratings,22121,7,HECMontrealX,Business & Management,Introductory,Français,20878
GeorgetownX: Quantum Mechanics,None,None,6876,18,GeorgetownX,Physics,Intermediate,English,25908
"HarvardX: Citizen Politics in America: Public Opinion, Elections, Interest Groups, and the Media",4.7,23 ratings,37796,4,HarvardX,Social Sciences,Introductory,English,12493
LehighX: Python Fundamentals for Business Analytics,None,None,None,6,LehighX,Computer Science,Introductory,English,15008
HarveyMuddX: Digital Design,None,None,10407,10,HarveyMuddX,Engineering,Introductory,English,15876
UPValenciaX: Word intermedio: herramientas de formato y productividad,4.6,13 ratings,22156,6,UPValenciaX,Computer Science,Intermediate,Español,3773
ISCEA: Supply Chain Management Tools and Techniques,4.3,35 ratings,6851,4,ISCEA,Business & Management,Introductory,English,30939
FedericaX: Introduction to psychology of personality,4,6 ratings,7414,7,FedericaX,Humanities,Intermediate,English,4612
LinuxFoundationX: Introduction to RISC-V,3.2stars,6 ratings,10400,7,LinuxFoundationX,Computer Science,Introductory,English,15876
DelftX: Introduction to Water and Climate,4.3,20 ratings,44346,10,DelftX,Engineering,Intermediate,English,11655
"ISCEA: Sustainable Supply Chain Planning, Sourcing, and Procurement",4.4,23 ratings,5904,4,ISCEA,Business & Management,Intermediate,English,41839
DelftX: Linear Algebra I: Vectors and Linear Equations,None,None,None,6,DelftX,Math,Intermediate,English,12493
ColumbiaX: Risk & Return,4.6,32 ratings,32057,4,ColumbiaX,Business & Management,Introductory,English,18865
TecdeMonterreyX: Energía eléctrica: conceptos y principios básicos,None,None,21213,7,TecdeMonterreyX,Engineering,Intermediate,Español,4947
TokyoTechX: Introduction to Computer Science and Programming,None,None,9576,5,TokyoTechX,Computer Science,Introductory,English,6636
HarvardX: China Humanities: The Individual in Chinese Culture,4.6,6 ratings,17129,8,HarvardX,Humanities,Introductory,English,12493
UBCx: Software Engineering: Introduction,4.3,11 ratings,53994,8,UBCx,Computer Science,Advanced,English,10481
"WageningenX: Agricultural Water Management: Water,-Society and Technology Interactions",4.2,14 ratings,5591,10,WageningenX,Environmental Studies,Intermediate,English,14170
RITx: Design Thinking: Empathizing to Understand the Problem,4.4stars,8 ratings,18158,6,RITx,Business & Management,Intermediate,English,28308
AnahuacX: Psicología Positiva,None,None,None,4,AnahuacX,Social Sciences,Introductory,Español,2180
"UMD, USMx: Identifying Entrepreneurial Opportunities",4.8,6 ratings,22765,4,UMD,Business & Management,Introductory,English,15847
UPValenciaX: Aprendizaje automático (machine learning) y ciencia de datos,4.6,16 ratings,25949,5,UPValenciaX,Computer Science,Intermediate,Español,3270
LinuxFoundationX: Open Source Software Development: Linux for Developers,4.3,7 ratings,6114,14,LinuxFoundationX,Computer Science,Introductory,English,15847
"UMD, USMx: Agile Innovation and Problem Solving Skills",4.5stars,37 ratings,27240,4,UMD,Engineering,Advanced,English,20916
JaverianaX: Fundamentos de la Tecnología Blockchain,4.3,9 ratings,30267,5,JaverianaX,Economics & Finance,Introductory,Español,3773
IsraelX: Essentials of Genomics and Biomedical Informatics,4.6,5 ratings,12193,12,IsraelX,Medicine,Advanced,English,4947
LinuxFoundationX: Introduction to Serverless on Kubernetes,None,None,13153,7,LinuxFoundationX,Computer Science,Introductory,English,17556
AWS: Architecting Solutions on AWS,4.4,8 ratings,None,4,AWS,Computer Science,Intermediate,English,4947
EPFLx: Space Mission Design and Operations,4.6,14 ratings,30630,8,EPFLx,Engineering,Intermediate,English,4947
MindEdge: HR Skills® Fundamentals,None,None,None,2,MindEdge,Business & Management,Introductory,English,29316
CurtinX: Digital Branding and Engagement,4.7,11 ratings,140803,4,CurtinX,Communication,Intermediate,English,8301
AdelaideX: MathTrackX: Differential Calculus,4.8,6 ratings,6680,4,AdelaideX,Math,Introductory,English,8301
HECMontrealX: Introduction to User Experience,4.1,9 ratings,22398,4,HECMontrealX,Computer Science,Intermediate,English,20878
EdinburghX: Sustainable Global Food Systems,4.5stars,25 ratings,5577,5,EdinburghX,Food & Nutrition,Introductory,English,4956
URosarioX: Redes de computadores,None,None,7770,1,URosarioX,Computer Science,Intermediate,Español,3270
IMFx: Foundations of Central Bank Law,4.5,21 ratings,15305,9,IMFx,Law,Intermediate,English,2096
Codio: Java Programming: Intermediate Concepts,None,None,None,4,Codio,Computer Science,Introductory,English,15847
UPValenciaX: Fundamentos de Mecánica para Ingeniería,None,None,23044,6,UPValenciaX,Physics,Introductory,Español,1593
GTx: Linear Algebra II: Matrix Algebra,4.6stars,8 ratings,8736,3,GTx,Math,Intermediate,English,20916
HKUx: Fundamentals of Aesthetic Dentistry,3.8stars,5 ratings,None,4,HKUx,Medicine,Introductory,English,8316
DelftX: Sustainable Building with Timber,4.6,10 ratings,None,7,DelftX,Architecture,Introductory,English,11655
UPValenciaX: Introducción a los encofrados y las cimbras en obra civil y edificación,4.2,10 ratings,31139,4,UPValenciaX,Engineering,Introductory,Español,3270
KULeuvenX: UML Class Diagrams for Software Engineering,4.2,20 ratings,43124,3,KULeuvenX,Computer Science,Introductory,English,4947
AnahuacX: Gestión del estrés y Mindfulness,4.8stars,9 ratings,34195,4,AnahuacX,Health & Safety,Introductory,Español,3276
NYIF: Fundamentals of Market Structure,4.5,18 ratings,40557,1,NYIF,Economics & Finance,Introductory,English,2096
W3Cx: HTML5 Coding Essentials and Best Practices,4.5,12 ratings,259274,6,W3Cx,Computer Science,Intermediate,English,20878
"UMD, USMx: Agile Process, Project, and Program Controls",4.6stars,27 ratings,25226,4,UMD,Engineering,Advanced,English,20916
UCSanDiegoX: Probability and Statistics in Data Science using Python,3.6,15 ratings,132325,10,UCSanDiegoX,Data Analysis & Statistics,Advanced,English,29346
AdelaideX: World of Wine: From Grape to Glass,5,5 ratings,103334,6,AdelaideX,Science,Introductory,English,16685
HarvardX: MLOps for Scaling TinyML,4.6stars,8 ratings,5020,7,HarvardX,Computer Science,Advanced,English,25116
UCR: Nutrition and Healthy Living,4.4,19 ratings,None,6,UCR,Food & Nutrition,Introductory,English,4947
logycaX: Fundamentos de logística,4.9,7 ratings,22965,5,logycaX,Engineering,Introductory,Español,3773
StellenboschX: People analytics and reporting,4.6,48 ratings,None,2,StellenboschX,Business & Management,Intermediate,English,12493
IBM: Elevating Businesses and Careers with Generative AI,4.2,5 ratings,None,3,IBM,Computer Science,Introductory,English,4108
RaspberryPiFoundation: Teaching Physical Computing with Raspberry Pi and Python,4.8stars,14 ratings,None,4,RaspberryPiFoundation,Education & Teacher Training,Intermediate,English,4956
"UMD, USMx: Let's Get Started: Building Self-Awareness",4.6,5 ratings,13935,5,UMD,Business & Management,Introductory,English,20878
ColumbiaX: Crisis Resource Management,4.7stars,34 ratings,5636,12,ColumbiaX,Health & Safety,Introductory,English,4200
"UMD, USMx: Project Delivery Methods and Contracts in Construction Management",4.2,20 ratings,5019,4,UMD,Engineering,Intermediate,English,20878
RITx: International Project Management,4.3,19 ratings,55284,9,RITx,Business & Management,Advanced,English,37647
IsraelX: Critical Thinking: Fundamentals of Good Reasoning,None,None,15960,13,IsraelX,Philosophy & Ethics,Introductory,English,15847
TecdeMonterreyX: Estrategias y estilos de negociación,None,None,21415,4,TecdeMonterreyX,Business & Management,Introductory,Español,15876
HarvardX: Statistical Inference and Modeling for High-throughput Experiments,4.4,6 ratings,64770,4,HarvardX,Data Analysis & Statistics,Intermediate,English,18362
"UMD, USMx: Achieving Product-Market Fit",4.8,18 ratings,10838,4,UMD,Business & Management,Introductory,English,20878
URosarioX: Manejo del estrés desde la neurociencia,None,None,None,4,URosarioX,Medicine,Introductory,Español,3270
IIMBx: Behavioral Economics and Public Policy,None,None,None,6,IIMBx,Economics & Finance,Intermediate,English,15876
StellenboschX: Freedom of expression in the African media and digital policy landscape,None,None,None,4,StellenboschX,Communication,Advanced,English,8301
AlaskaX: Behavioral Neuroscience: Analyzing Anxiety and Depression,None,None,None,5,AlaskaX,Biology & Life Sciences,Intermediate,English,15847
"WageningenX: Circular Fashion: Design, Science and Value in a Sustainable Clothing Industry",4.8,5 ratings,30184,5,WageningenX,Art & Culture,Introductory,English,14170
UTokyoX: Quantum Mechanics of Molecular Structures,4.5,6 ratings,26310,6,UTokyoX,Physics,Intermediate,English,4947
CatalystX: Cómo Convertirse en un Líder Exitoso (Entrenamiento de Liderazgo Inclusivo),None,None,19183,4,CatalystX,Business & Management,Introductory,Español,4956
BerkleeX: Introduction to the Music Business,4.7,20 ratings,58926,6,BerkleeX,Business & Management,Introductory,English,4947
JaverianaX: Alimentación saludable y sostenible,None,None,None,5,JaverianaX,Food & Nutrition,Introductory,Español,3773
UPValenciaX: Fundamentos de ciberseguridad para usuarios,None,None,None,2,UPValenciaX,Computer Science,Introductory,Español,1174
URosarioX: Marketing para emprendedores,None,None,None,4,URosarioX,Business & Management,Introductory,Español,3276
LCIEducation: Introduction to Game Design: Process and Creation,None,None,None,5,LCIEducation,Computer Science,Introductory,English,15008
JaverianaX: Arduino para niños ¡vamos al espacio!,None,None,17955,6,JaverianaX,Electronics,Introductory,Español,2096
WasedaX: IoT System Design: Software and Hardware Integration,4.2,10 ratings,16805,4,WasedaX,Computer Science,Intermediate,English,10816
"GTx: Data Structures & Algorithms III: AVL and 2-4 Trees, Divide and Conquer Algorithms",None,None,5230,5,GTx,Computer Science,Intermediate,English,15847
UBCx: Video Game Writing Essentials,4.2,19 ratings,8776,5,UBCx,Communication,Introductory,English,8301
LinuxFoundationX: Computer Architecture with an Industrial RISC-V Core [RVfpga],None,None,None,10,LinuxFoundationX,Computer Science,Intermediate,English,12493
TecdeMonterreyX: Principios de Economía aplicados a Negocios,None,None,8233,4,TecdeMonterreyX,Economics & Finance,Advanced,Español,4947
BerkeleyX: Real-World Applications of Economics,None,None,None,5,BerkeleyX,Economics & Finance,Intermediate,English,8301
TecdeMonterreyX: Introducción a Ciencias de Datos y Estadística Básica para Negocios,None,None,13408,4,TecdeMonterreyX,Data Analysis & Statistics,Advanced,Español,5785
"PennX: Hollywood: History, Industry, Art",None,None,67599,4,PennX,Communication,Introductory,English,14170
UPValenciaX: Programación en Python: visualización de datos,None,None,None,6,UPValenciaX,Data Analysis & Statistics,Intermediate,Español,3276
UPValenciaX: Physics Fundamentals: Mechanics,4.5,17 ratings,None,6,UPValenciaX,Physics,Introductory,English,2432
IMFx: Cyber Risk Supervision,4.5,29 ratings,None,4,IMFx,Economics & Finance,Introductory,English,2096
UPValenciaX: Introducción a la energía solar fotovoltaica: El módulo fotovoltaico,4.3stars,15 ratings,26569,4,UPValenciaX,Engineering,Intermediate,Español,3276
DoaneX: BioStatistics,None,None,26310,8,DoaneX,Biology & Life Sciences,Introductory,English,9978
MITx: Structural Materials: Selection and Economics,4.8,14 ratings,14203,3,MITx,Engineering,Introductory,English,4192
CurtinX: The Minerals and Mining Business,4.6,10 ratings,6166,8,CurtinX,Engineering,Advanced,English,36808
DelftX: Biomedical Equipment: A Practical Approach to Healthcare Technology Management,4.6,10 ratings,None,6,DelftX,Engineering,Introductory,English,4192
WisconsinX: Introduction to Online Education & Course Planning,4.6stars,21 ratings,None,3,WisconsinX,Education & Teacher Training,Introductory,English,9996
URosarioX: Bases de datos,None,None,5572,4,URosarioX,Engineering,Intermediate,Español,3270
DelftX: Technology of Intelligent and Integrated Energy Systems,4.4,17 ratings,None,6,DelftX,Engineering,Intermediate,English,12493
UAMx: Introducción a la genética y la evolución,4.1,13 ratings,30922,3,UAMx,Biology & Life Sciences,Introductory,Español,2432
HarvardX: China’s Political and Intellectual Foundations: From Sage Kings to Confucius,None,None,56843,12,HarvardX,History,Introductory,English,12493
UAMx: La Química Orgánica: un mundo a tu alcance,None,None,31016,6,UAMx,Chemistry,Introductory,Español,2432
"LinuxFoundationX: Business Considerations for 5G with Edge, IoT, and AI",4.1,23 ratings,13111,10,LinuxFoundationX,Business & Management,Introductory,English,15847
StellenboschX: Higher education teaching in the age of AI,None,None,None,3,StellenboschX,Education & Teacher Training,Intermediate,English,12493
IBM: The Data Science Method,4.5,13 ratings,17351,7,IBM,Data Analysis & Statistics,Introductory,English,8301
UAMx: Riñones: conoce sus funciones para mejorar tu salud y calidad de vida,5.0stars,5 ratings,29765,6,UAMx,Medicine,Introductory,Español,2436
DoaneX: Fundamentals of Sociology,4,9 ratings,9423,8,DoaneX,Social Sciences,Introductory,English,9978
UPValenciaX: Bases Matemáticas: Álgebra,None,None,55189,4,UPValenciaX,Math,Introductory,Español,1593
DoaneX: Assembler Language,4.3,14 ratings,None,11,DoaneX,Computer Science,Intermediate,English,20878
GTx: Probability and Statistics II:  Random Variables – Great Expectations to Bell Curves,None,None,6640,4,GTx,Data Analysis & Statistics,Intermediate,English,20916
"UMD, USMx: Effective Communication for Program and Project Stakeholders and Teams",4.5,19 ratings,11046,5,UMD,Business & Management,Introductory,English,20878
"DartmouthX, IMTx: Linux Basics: The Command Line Interface",None,None,46329,5,DartmouthX,Computer Science,Introductory,English,8301
ChalmersX: Hybrid Vehicles,4.3,7 ratings,26761,7,ChalmersX,Engineering,Advanced,English,20878
GTx: Computing for Data Analysis,4.2,10 ratings,57803,15,GTx,Computer Science,Advanced,English,69173
QueensX: Enterprise Selling,None,None,15766,6,QueensX,Business & Management,Introductory,English,15847
URosarioX: Excel financiero pro: domina las finanzas con Excel,None,None,None,2,URosarioX,Economics & Finance,Intermediate,Español,4108
UPValenciaX: Sustainability in Architecture: An Interdisciplinary Introduction,4.1,34 ratings,49388,4,UPValenciaX,Architecture,Intermediate,English,3270
RaspberryPiFoundation: Teach Teens Computing: Understanding AI for Educators,None,None,None,3,RaspberryPiFoundation,Education & Teacher Training,Introductory,English,4947
UPValenciaX: IT Fundamentals for Business Professionals: Enterprise Systems,4.2,17 ratings,29107,4,UPValenciaX,Computer Science,Introductory,English,5785
"GTx: Data Structures & Algorithms IV: Pattern Matching, Dijkstra’s, MST, and Dynamic Programming Algorithms",4.8stars,5 ratings,5468,5,GTx,Computer Science,Intermediate,English,15876
RITx: Cybersecurity Risk Management,4.5,13 ratings,44631,8,RITx,Computer Science,Advanced,English,33454
StanfordOnline: Databases: Semistructured Data,None,None,7240,2,StanfordOnline,Computer Science,Introductory,English,5785
IBM: Threat Intelligence in Cybersecurity,None,None,None,6,IBM,Computer Science,Introductory,English,12493
AWS: Migrating to the AWS Cloud,None,None,7949,4,AWS,Computer Science,Intermediate,English,4956
"AdelaideX: MathTrackX: Polynomials, Functions and Graphs",4.3stars,9 ratings,12931,4,AdelaideX,Math,Introductory,English,8316
ChalmersX: Model-Based Automotive Systems Engineering,None,None,23086,7,ChalmersX,Engineering,Advanced,English,20878
TecdeMonterreyX: Herramientas para el Análisis de Big Data,4.4,13 ratings,19267,4,TecdeMonterreyX,Data Analysis & Statistics,Intermediate,Español,4947
GalileoX: Introducción a los circuitos eléctricos,None,None,19688,5,GalileoX,Electronics,Intermediate,Español,3270
IBM: Computer Vision and Image Processing Fundamentals.,4.2,12 ratings,20811,3,IBM,Computer Science,Introductory,English,8301
IMFx: VITARA - Human Resource Management,4.8stars,23 ratings,None,1,IMFx,Economics & Finance,Introductory,English,2100
KULeuvenX: AI in Healthcare. Hype or Help?,None,None,None,10,KULeuvenX,Medicine,Advanced,English,6758
CurtinX: Build your very first iOS app,None,None,50726,8,CurtinX,Computer Science,Introductory,English,15876
UCSanDiegoX: The Science of Parenting,None,None,48443,5,UCSanDiegoX,Social Sciences,Introductory,English,4108
IBM: Test and Behavior Driven Development (TDD/BDD),4.2stars,6 ratings,None,4,IBM,Computer Science,Intermediate,English,8316
Wharton: Strategic Management Capstone,4.6,46 ratings,11383,6,Wharton,Business & Management,Intermediate,English,16685
UCDavis: Animation with JavaScript and jQuery,None,None,None,4,UCDavis,Computer Science,Introductory,English,4116
DartmouthX: The Engineering of Structures Around Us,4.7,13 ratings,22862,5,DartmouthX,Engineering,Introductory,English,6624
BoxPlay: Critical Thinking: How to Develop Critical Thinking Skills,4.2,13 ratings,None,1,BoxPlay,Communication,Introductory,English,5785
HECMontrealX: UX Prototyping,None,None,9123,6,HECMontrealX,Design,Intermediate,English,30996
AlaskaX: 3D GIS,4.3,18 ratings,5018,4,AlaskaX,Engineering,Intermediate,English,15847
MITx: Molecular Biology – Part 3: RNA Processing and Translation,None,None,23424,8,MITx,Biology & Life Sciences,Advanced,English,8301
UPValenciaX: Diseña presentaciones eficaces con Powerpoint,4.4,7 ratings,55068,3,UPValenciaX,Computer Science,Introductory,Español,3773
HKUSTx: Mathematical Methods for Data Analysis,None,None,None,8,HKUSTx,Math,Intermediate,English,36876
WBGx: Solid Waste Management,4.5stars,26 ratings,17560,6,WBGx,Environmental Studies,Introductory,English,420
DelftX: Waste Management and Critical Raw Materials,4.2,6 ratings,18064,6,DelftX,Business & Management,Introductory,English,12493
"UPValenciaX: Diseña, fabrica y programa tu propio robot",None,None,34123,6,UPValenciaX,Engineering,Introductory,Español,5785
LehighX: Economics Fundamentals for Business Analytics,4.7,7 ratings,None,6,LehighX,Economics & Finance,Introductory,English,15008
StanfordOnline: Introduction to Healthcare Communication Strategies,None,None,None,4,StanfordOnline,Medicine,Intermediate,English,20878
LinuxFoundationX: Linux Tools for Software Development,None,None,5437,14,LinuxFoundationX,Computer Science,Introductory,English,15847
AnahuacX: Introducción a la Ciencia de Datos con Python,4.5,10 ratings,17773,4,AnahuacX,Computer Science,Introductory,Español,3270
"GTx: Introduction to Object-Oriented Programming with Java III: Exceptions, Data Structures, Recursion, and GUIs",4.2,10 ratings,6586,6,GTx,Computer Science,Introductory,English,20878
WageningenX: Drainage in Agriculture: controlling water and salt levels in the soil,4.2,5 ratings,8638,5,WageningenX,Environmental Studies,Advanced,English,14170
IBM: Cybersecurity Analyst Assessment,None,None,None,1,IBM,Computer Science,Advanced,English,12493
MichiganX: Storytelling for Social Change,4.5,23 ratings,47516,5,MichiganX,Communication,Introductory,English,4947
"UMD, USMx: Modern Product Leadership",4.1stars,11 ratings,8055,4,UMD,Business & Management,Introductory,English,20916
edX: Designing a Course With edX,4.5,12 ratings,None,1,edX,Design,Introductory,English,8301
HarveyMuddX: Computer Architecture,None,None,7156,14,HarveyMuddX,Engineering,Introductory,English,15876
"DavidsonX, GalileoX: Intro to AI for Digital Marketing",None,None,None,3,DavidsonX,Business & Management,Introductory,English,4116
AdelaideX: Academic Writing,None,None,None,4,AdelaideX,Language,Introductory,English,10481
BabsonX: Marketing Fundamentals: Who Is Your Customer?,None,None,30781,4,BabsonX,Business & Management,Introductory,English,20916
URosarioX: Corrección de textos jurídicos,None,None,None,4,URosarioX,Communication,Introductory,Español,3276
UniversityofCambridge: Finding your voice as a playwright,4.4,8 ratings,9408,4,UniversityofCambridge,Communication,Intermediate,English,25070
IBM: IT Support Case Studies,None,None,None,6,IBM,Computer Science,Intermediate,English,8301
BabsonX: Economics: Consumer Demand,4.8stars,23 ratings,16012,4,BabsonX,Economics & Finance,Introductory,English,20916
DavidsonX: Introduction to Pharmacokinetics: From ADME to PK/PD,None,None,None,3,DavidsonX,Chemistry,Intermediate,English,16716
SmithsonianX: Designing for Textiles,4.6,17 ratings,None,2,SmithsonianX,Art & Culture,Introductory,English,503
HarvardX: Shakespeare’s Othello: The Moor,5,12 ratings,40700,4,HarvardX,Humanities,Introductory,English,12493
ColumbiaX: Learning Success,4.8stars,9 ratings,6322,10,ColumbiaX,Education & Teacher Training,Introductory,English,4200
IBM: Relational Database Administration (DBA),4.8,5 ratings,None,8,IBM,Computer Science,Introductory,English,8301
Codio: C++ Programming: Intermediate Concepts,None,None,None,5,Codio,Computer Science,Introductory,English,15847
ETHx: Beyond Systems Thinking,None,None,None,6,ETHx,Social Sciences,Introductory,English,4192
StanfordOnline: Semantics of First-Order Logic,4.4stars,6 ratings,5795,4,StanfordOnline,Philosophy & Ethics,Introductory,English,5796
GeorgetownX: Terrorism and Counterterrorism,4.1,57 ratings,36391,7,GeorgetownX,Humanities,Introductory,English,4947
IDBx: Women's Leadership: Boost your skills and drive change,4.5,38 ratings,None,10,IDBx,Communication,Intermediate,English,2432
UPValenciaX: Math Fundamentals: Algebra,None,None,None,4,UPValenciaX,Math,Introductory,English,2432
ChalmersX: Master Control in Supply Chain Management and Logistics,4.4stars,39 ratings,47572,8,ChalmersX,Business & Management,Introductory,English,4116
"ImperialX: A-level Mathematics for Year 13 - Course 1: Functions, Sequences and Series, and Numerical Methods",4.6,24 ratings,None,7,ImperialX,Math,Intermediate,English,5785
NYIF: Stock Trading Professional Certification Examination,5,12 ratings,None,1,NYIF,Economics & Finance,Introductory,English,None
HKUSTx: English for Doing Business in Asia – Speaking,None,None,75959,7,HKUSTx,Humanities,Introductory,English,14170
UCSanDiegoX: Algorithmic Design and Techniques,None,None,52092,6,UCSanDiegoX,Computer Science,Intermediate,English,12600
DartmouthX: Retail Fundamentals,4.4,5 ratings,45594,4,DartmouthX,Business & Management,Intermediate,English,20878
AdelaideX: Music Technology Foundations,4.8,6 ratings,44897,6,AdelaideX,Computer Science,Introductory,English,14170
AI: Introduction to Generative AI,4.0stars,6 ratings,None,3,AI,Computer Science,Introductory,English,37716
AnahuacX: E-Commerce Estratégico,None,None,None,5,AnahuacX,Business & Management,Introductory,Español,3270
HarvardX: Shakespeare's The Merchant of Venice: Shylock,4.4stars,10 ratings,30317,4,HarvardX,Humanities,Introductory,English,12516
MandarinX: Mandarin Chinese for Business,4.4,8 ratings,20020,6,MandarinX,Language,Intermediate,English,15847
LinuxFoundationX: Introduction to AI/ML Toolkits with Kubeflow,None,None,None,10,LinuxFoundationX,Computer Science,Introductory,English,12493
CurtinX: Autism and Neurodiversity: Building Your Child's Strengths,4.4,14 ratings,6463,6,CurtinX,Health & Safety,Introductory,English,8301
IDBx: Mulheres na liderança: potencialize suas habilidades e impulsione a mudança,None,None,None,10,IDBx,Communication,Intermediate,Português,2432
NYIF: Fundamentals of Financial Mathematics and Capital Budgeting,4.9stars,8 ratings,11196,4,NYIF,Economics & Finance,Introductory,English,8316
HKUx: Advanced Cardiac Imaging: Cardiac Computed Tomography (CT),4.6,17 ratings,11069,4,HKUx,Medicine,Introductory,English,12493
LinuxFoundationX: Git for Distributed Software Development,None,None,6204,14,LinuxFoundationX,Computer Science,Introductory,English,15847
HECMontrealX: Le management,4.8stars,13 ratings,20636,5,HECMontrealX,Business & Management,Introductory,Français,20916
ZHAWx: Cell cultivation techniques: An introduction,4.7,7 ratings,None,8,ZHAWx,Biology & Life Sciences,Intermediate,English,15847
