Course_Name,Rating,No_of_Ratings,No_of_Enrollment,Duration,Institution,Subject,Level,Language,Price
edX: How to Learn Online,4.2stars,66 ratings,295854,2,edX,Education & Teacher Training,Introductory,English,5796
BerkeleyX: The Science of Happiness,4.6,38 ratings,586360,11,BerkeleyX,Social Sciences,Introductory,English,14170
HarvardX: Remote Work Revolution for Everyone,4.6,96 ratings,119751,3,HarvardX,Business & Management,Introductory,English,12493
CS50's Introduction to Computer Science,None,None,6069194,12,HarvardX,Computer Science,Introductory,English,None
IBM: Data Visualization and Building Dashboards with Excel and Cognos,4.4,94 ratings,50423,4,IBM,Data Analysis & Statistics,Introductory,English,8301
"TUMx: Six Sigma Part 2: Analyze, Improve, Control",4.7stars,45 ratings,86213,8,TUMx,Business & Management,Introductory,English,15876
HarvardX: CS50's Introduction to Programming with Python,None,None,1086875,10,HarvardX,Computer Science,Introductory,English,None
IBM: Analyzing Data with Excel,4.4,450 ratings,252547,5,IBM,Data Analysis & Statistics,Introductory,English,8301
PennX: The Science of Generosity: Do Good…Feel Good,None,None,None,4,PennX,Philanthropy,Introductory,English,4108
BabsonX: Entrepreneurial Operations: Launching a Startup,4.7,17 ratings,49083,4,BabsonX,Business & Management,Intermediate,English,15847
IIMBx: Marketing Management,4.3,47 ratings,139290,9,IIMBx,Business & Management,Intermediate,English,12577
BerkeleyX: The Foundations of Happiness at Work,4.5,25 ratings,102178,4,BerkeleyX,Business & Management,Introductory,English,16685
W3Cx: Introduction to Web Accessibility,4.4,70 ratings,74588,4,W3Cx,Computer Science,Introductory,English,8301
ImperialX: Coaching Skills for Learner-Centred Conversations,4.6stars,42 ratings,24350,4,ImperialX,Education & Teacher Training,Introductory,English,4956
"USMx, UMD: Creating Innovative Business Models",4.8,14 ratings,28564,4,UMD,Business & Management,Introductory,English,15847
ANUx: Greatest Unsolved Mysteries of the Universe,4.9,28 ratings,114211,9,ANUx,Physics,Intermediate,English,4947
SmithsonianX: Interdisciplinary Teaching with Museum Objects,4.1,11 ratings,None,14,SmithsonianX,Education & Teacher Training,Introductory,English,5785
NUS: Intercultural Communication at Work – Land the job and do it well,None,None,13753,6,NUS,Communication,Intermediate,English,4956
"UMD, USMx: Data Science and Agile Systems for Product Management",4.7,7 ratings,16208,4,UMD,Business & Management,Intermediate,English,20878
"ImperialBusinessX, ImperialX: Climate Change: Financial Risks and Opportunities",4.1stars,22 ratings,None,4,ImperialBusinessX,Economics & Finance,Intermediate,English,6624
HarvardX: CS50's Introduction to Artificial Intelligence with Python,None,None,1132411,7,HarvardX,Computer Science,Introductory,English,None
HarvardX: Exercising Leadership: Foundational Principles,4.6stars,886 ratings,622786,4,HarvardX,Business & Management,Introductory,English,17556
RITx: Storytelling in the Workplace,4.4,65 ratings,34269,3,RITx,Communication,Introductory,English,16685
HarvardX: CS50's Web Programming with Python and JavaScript,None,None,1482100,12,HarvardX,Computer Science,Intermediate,English,None
GoogleCloud: Google Cloud Computing Foundations: Cloud Computing Fundamentals,4.5,31 ratings,69235,1,GoogleCloud,Computer Science,Introductory,English,12493
HarvardX: Introduction to Data Science with Python,4.3stars,109 ratings,166113,8,HarvardX,Data Analysis & Statistics,Intermediate,English,25116
HarvardX: CS50's Introduction to Cybersecurity,None,None,198078,5,HarvardX,Computer Science,Introductory,English,None
IBM: Python Basics for Data Science,4.4,801 ratings,799472,3,IBM,Data Analysis & Statistics,Intermediate,English,8301
HarvardX: Building Personal Resilience: Managing Anxiety and Mental Health,4.6,127 ratings,100147,6,HarvardX,Social Sciences,Introductory,English,18362
HarvardX: Data Science: Machine Learning,4.3stars,85 ratings,587853,8,HarvardX,Data Analysis & Statistics,Introductory,English,12516
HarvardX: Rhetoric: The Art of Persuasive Writing and Public Speaking,4.6,302 ratings,763568,8,HarvardX,Humanities,Introductory,English,17524
UQx: IELTS Academic Test Preparation,4.8stars,61 ratings,1648661,8,UQx,Communication,Introductory,English,18396
MITx: Becoming an Entrepreneur,4.2,60 ratings,273512,6,MITx,Business & Management,Introductory,English,5785
DavidsonX: Excel for Beginners,4.5,564 ratings,161788,4,DavidsonX,Data Analysis & Statistics,Introductory,English,20878
HarvardX: Human Anatomy: Musculoskeletal Cases,4.8,158 ratings,285338,7,HarvardX,Medicine,Intermediate,English,17524
HarvardX: Data Science: R Basics,4.4stars,176 ratings,889850,8,HarvardX,Data Analysis & Statistics,Introductory,English,18396
DoaneX: Business Writing Techniques,4.6,485 ratings,43137,4,DoaneX,Communication,Introductory,English,12493
HarvardX: CS50's Introduction to Databases with SQL,None,None,67442,7,HarvardX,Computer Science,Introductory,English,None
"HarvardX: Fundamentals of Neuroscience, Part 1: The Electrical Properties of the Neuron",4.7,101 ratings,607921,5,HarvardX,Biology & Life Sciences,Introductory,English,20878
IBM: Machine Learning with Python: A Practical Introduction,4.5,402 ratings,178346,5,IBM,Data Analysis & Statistics,Introductory,English,8301
IBM: AI for Everyone: Master the Basics,4.4,292 ratings,185899,4,IBM,Computer Science,Introductory,English,8301
URosarioX: Inglés para todos: nivel básico,4.7,9 ratings,220690,4,URosarioX,Language,Introductory,Español,4108
"IBM: Introduction to Web Development with HTML5, CSS3, and JavaScript.",4.4stars,407 ratings,143244,2,IBM,Computer Science,Intermediate,English,4116
HarvardX: CS50's Introduction to Programming with Scratch,None,None,194161,3,HarvardX,Computer Science,Introductory,English,None
LinuxFoundationX: Introduction to Kubernetes,4.4,37 ratings,368943,14,LinuxFoundationX,Computer Science,Introductory,English,15847
HarvardX: Managing Happiness,4.7stars,322 ratings,150518,6,HarvardX,Social Sciences,Introductory,English,18396
HarvardX: Contract Law: From Trust to Promise to Contract,4.8,258 ratings,594785,8,HarvardX,Business & Management,Intermediate,English,25070
WellesleyX: Italian Language and Culture: Beginner (2023-2024),4.7,138 ratings,375976,12,WellesleyX,Language,Introductory,Italiano,4947
HarvardX: Entrepreneurship in Emerging Economies,4.6,204 ratings,836833,6,HarvardX,Business & Management,Introductory,English,20878
ETSx: TOEFL iBT Test Preparation: The Insider’s Guide,4.6,141 ratings,1538009,6,ETSx,Communication,Introductory,English,5031
IBM: Data Analytics Basics for Everyone,4.4stars,226 ratings,170856,5,IBM,Data Analysis & Statistics,Introductory,English,8316
UPValenciaX: Basic Spanish 1: Getting Started,4.5,130 ratings,607881,7,UPValenciaX,Communication,Introductory,English,2432
HarvardX: CS50's Computer Science for Business Professionals,None,None,214717,6,HarvardX,Computer Science,Introductory,English,None
MITx: Foundations of Modern Finance I,None,None,106584,12,MITx,Economics & Finance,Advanced,English,46116
UQx: English Grammar and Style,4.5,21 ratings,806424,8,UQx,Humanities,Introductory,English,10816
HarvardX: Justice,4.8,156 ratings,586508,12,HarvardX,Humanities,Introductory,English,17524
IBM: Introduction to Cloud Computing,4.6,379 ratings,104545,3,IBM,Computer Science,Introductory,English,4108
HarvardX: The Architectural Imagination,4.8stars,108 ratings,575334,10,HarvardX,Architecture,Introductory,English,20916
HarvardX: Machine Learning and AI with Python,3.7,6 ratings,20180,6,HarvardX,Data Analysis & Statistics,Intermediate,English,25070
IIMBx: Financial Accounting and Analysis,4.5,170 ratings,37229,6,IIMBx,Business & Management,Intermediate,English,4192
LinuxFoundationX: Introduction to Linux,4.4,175 ratings,873187,14,LinuxFoundationX,Computer Science,Introductory,English,17524
IBM: Introduction to Prompt Engineering,4.5,212 ratings,15592,3,IBM,Computer Science,Introductory,English,4108
IBM: Cybersecurity Basics,4.3,220 ratings,96287,4,IBM,Computer Science,Introductory,English,12493
HarvardX: Statistics and R,4.1,62 ratings,467610,4,HarvardX,Data Analysis & Statistics,Intermediate,English,18362
MITx: Circuits and Electronics 1: Basic Circuit Analysis,4.6,22 ratings,139776,5,MITx,Electronics,Introductory,English,15847
HarvardX: Calculus Applied!,4.8,29 ratings,156634,10,HarvardX,Math,Intermediate,English,None
EdinburghX: Digital Marketing Strategy,4.5,70 ratings,117348,8,EdinburghX,Business & Management,Intermediate,English,12493
UniversityofCambridge: Foundations of Finance,4.5stars,54 ratings,72611,5,UniversityofCambridge,Economics & Finance,Introductory,English,25116
IBM: Introduction to Data Science,4.5,222 ratings,163778,6,IBM,Data Analysis & Statistics,Introductory,English,8301
StanfordOnline: Databases: Relational Databases and SQL,4.4,35 ratings,119828,2,StanfordOnline,Computer Science,Introductory,English,5785
StanfordOnline: Statistical Learning with Python,4.6,9 ratings,17072,11,StanfordOnline,Data Analysis & Statistics,Introductory,English,15595
HarvardX: The Path to Happiness: What Chinese Philosophy Teaches us about the Good Life,4.7,53 ratings,132922,13,HarvardX,Philosophy & Ethics,Introductory,English,12493
HarvardX: Data Science: Visualization,4.4,92 ratings,287567,8,HarvardX,Data Analysis & Statistics,Introductory,English,18362
HarvardX: Introduction to Probability,4.3,38 ratings,188610,10,HarvardX,Data Analysis & Statistics,Intermediate,English,17524
HarvardX: Leaders of Learning,4.6,309 ratings,367670,10,HarvardX,Communication,Introductory,English,17524
MITx: Introduction to Biology - The Secret of Life,None,None,232944,16,MITx,Biology & Life Sciences,Introductory,English,12600
HarvardX: Cell Biology: Mitochondria,4.7,161 ratings,137202,4,HarvardX,Biology & Life Sciences,Introductory,English,12493
GalileoX: Java Programming Fundamentals,4.4,104 ratings,40328,5,GalileoX,Engineering,Intermediate,English,3270
CornellX: A Hands-on Introduction to Engineering Simulations,4.8,24 ratings,294331,6,CornellX,Engineering,Intermediate,English,16685
W3Cx: HTML5 and CSS Fundamentals,4.5stars,122 ratings,414758,6,W3Cx,Computer Science,Introductory,English,20916
UPValenciaX: Upper-Intermediate English: Business and Modern Life,4.6,63 ratings,157924,4,UPValenciaX,Language,Intermediate,English,3270
HarvardX: Technology Entrepreneurship: Lab to Market,4.5stars,95 ratings,144789,5,HarvardX,Business & Management,Introductory,English,12516
RITx: Critical Thinking & Problem Solving,4.5,134 ratings,51591,3,RITx,Communication,Introductory,English,16685
IBM: Software Engineering Basics for Everyone,4.6,69 ratings,28482,6,IBM,Computer Science,Introductory,English,8301
MichiganX: Programming for Everybody (Getting Started with Python),4.7stars,141 ratings,581247,7,MichiganX,Computer Science,Introductory,English,4956
FullbridgeX: Communication Skills and Teamwork,4.5,322 ratings,31711,3,FullbridgeX,Business & Management,Introductory,English,None
ColumbiaX: Introduction to Corporate Finance,4.5,57 ratings,180233,4,ColumbiaX,Business & Management,Introductory,English,18865
NYIF: Intro to Stock Trading,3.9,38 ratings,31367,3,NYIF,Economics & Finance,Introductory,English,8301
edX: Prompt Engineering and Advanced ChatGPT,4.2,142 ratings,27916,1,edX,Computer Science,Intermediate,English,3354
AnahuacX: Inglés básico: conversacional y networking,4.3,48 ratings,298425,4,AnahuacX,Business & Management,Introductory,Español,3270
RaspberryPiFoundation: Introduction to Machine Learning and AI,4.5,144 ratings,13839,4,RaspberryPiFoundation,Education & Teacher Training,Introductory,English,4947
HarvardX: Using Python for Research,4.1stars,48 ratings,346823,12,HarvardX,Computer Science,Intermediate,English,20916
ArmEducationX: Build Your First Internet of Things (IoT) Application on Arm,4.4,213 ratings,13267,7,ArmEducationX,Computer Science,Intermediate,English,8301
UPValenciaX: Excel: Fundamentos y herramientas,4.6,49 ratings,438587,8,UPValenciaX,Computer Science,Introductory,Español,3270
IBM: Introduction to SQL,4.5stars,64 ratings,45709,5,IBM,Computer Science,Introductory,English,8316
FullbridgeX: Problem Solving and Critical Thinking Skills,4.5,218 ratings,32487,3,FullbridgeX,Business & Management,Introductory,English,None
Codio: Python Programming: Basic Skills,4.4,70 ratings,11163,5,Codio,Computer Science,Introductory,English,15847
UniversityofCambridge: The Psychology of Emotions: An Introduction to Embodied Cognition,4.4,54 ratings,42657,5,UniversityofCambridge,Biology & Life Sciences,Intermediate,English,25070
AdelaideX: Introduction to Project Management,4.4,248 ratings,510236,6,AdelaideX,Business & Management,Introductory,English,20878
UBCx: Excel for Everyone: Core Foundations,4.6,43 ratings,185043,6,UBCx,Data Analysis & Statistics,Introductory,English,15847
HarvardX: Data Science: Inference and Modeling,4.3,39 ratings,136813,8,HarvardX,Data Analysis & Statistics,Introductory,English,12493
HarvardX: Data Science: Probability,4.3,47 ratings,205869,8,HarvardX,Data Analysis & Statistics,Introductory,English,12493
"HarvardX: PredictionX: Omens, Oracles & Prophecies",4.8stars,56 ratings,175526,1,HarvardX,Social Sciences,Introductory,English,None
SOLIDWORKS: SOLIDWORKS CAD Fundamentals,4.5,73 ratings,29342,5,SOLIDWORKS,Design,Introductory,English,8301
IBM: Introduction to Generative AI,4.4,73 ratings,9503,3,IBM,Computer Science,Introductory,English,4108
IBM: R Programming Basics for Data Science,4.5stars,262 ratings,19379,5,IBM,Data Analysis & Statistics,Introductory,English,8316
CurtinX: Introduction to the Internet of Things (IoT),4.4,92 ratings,119876,6,CurtinX,Computer Science,Introductory,English,12493
"HarvardX: Fundamentals of Neuroscience, Part 3: The Brain",4.9,42 ratings,128447,8,HarvardX,Biology & Life Sciences,Introductory,English,20878
IBM: Developing Front End Apps with React,4.5stars,116 ratings,18566,4,IBM,Computer Science,Intermediate,English,2016
HarvardX: Food Fermentation: The Science of Cooking with Microbes,4.7,71 ratings,66524,14,HarvardX,Biology & Life Sciences,Introductory,English,20878
Codio: C++ Programming: Basic Skills,4.5,37 ratings,21310,5,Codio,Computer Science,Introductory,English,15847
HarvardX: Leadership: Creating Public Value,4.6,38 ratings,53633,7,HarvardX,Social Sciences,Introductory,English,17524
UniversityofCambridge: Introduction to Cognitive Psychology and Neuropsychology,4.4,23 ratings,15731,5,UniversityofCambridge,Biology & Life Sciences,Introductory,English,25070
LCIEducation: Graphic Design Essentials,4.1,7 ratings,9119,4,LCIEducation,Design,Introductory,English,8301
HarvardX: PredictionX: Lost Without Longitude,4.7,34 ratings,51423,1,HarvardX,History,Introductory,English,None
UCx: Mental Health and Nutrition,4.7stars,127 ratings,80530,8,UCx,Food & Nutrition,Introductory,English,15876
IBM: Data Science and Machine Learning Capstone Project,4.4,127 ratings,37220,6,IBM,Data Analysis & Statistics,Intermediate,English,12493
UPValenciaX: Marketing digital en redes sociales,4.3,36 ratings,46068,3,UPValenciaX,Business & Management,Introductory,Español,3773
IBM: Analyzing Data with R,4.5stars,167 ratings,11085,6,IBM,Data Analysis & Statistics,Introductory,English,8316
HarvardX: Early Childhood Development: Global Strategies for Implementation,4.8,155 ratings,74466,7,HarvardX,Education & Teacher Training,Introductory,English,12493
HarvardX: Principles of Biochemistry,4.6,42 ratings,386139,15,HarvardX,Medicine,Intermediate,English,25070
"GTx: Data Structures & Algorithms I: ArrayLists, LinkedLists, Stacks and Queues",4.7,15 ratings,37922,5,GTx,Computer Science,Intermediate,English,15847
IBM: DevOps Basics for Everyone,4.5,77 ratings,15728,3,IBM,Computer Science,Introductory,English,8301
IBM: SQL for Data Science,4.2stars,69 ratings,119098,4,IBM,Data Analysis & Statistics,Introductory,English,8316
"FullbridgeX: Resume, Networking, and Interview Skills",4.4,120 ratings,72912,3,FullbridgeX,Business & Management,Introductory,English,None
StanfordOnline: Quantum Mechanics for Scientists and Engineers 1,4.5,29 ratings,34204,9,StanfordOnline,Engineering,Introductory,English,13331
"WageningenX: Nutrition, Exercise and Sports",4.5stars,29 ratings,120885,6,WageningenX,Food & Nutrition,Intermediate,English,17556
IBM: Full Stack Application Development Project,4.3,54 ratings,29646,2,IBM,Computer Science,Intermediate,English,8301
IBM: Beginners Guide to Cybersecurity,4.5stars,61 ratings,17132,4,IBM,Computer Science,Introductory,English,4116
HarvardX: Pyramids of Giza: Ancient Egyptian Art and Archaeology,None,None,23899,8,HarvardX,Art & Culture,Introductory,English,18362
Codio: Java Programming: Basic Skills,4.6,26 ratings,10184,5,Codio,Computer Science,Introductory,English,15847
ArmEducationX: Embedded Systems Essentials with Arm: Getting Started,4.4,68 ratings,32170,6,ArmEducationX,Computer Science,Intermediate,English,8301
AWS: AWS Cloud Practitioner Essentials,4.4,138 ratings,48314,4,AWS,Computer Science,Introductory,English,12493
GTx: Computing in Python I: Fundamentals and Procedural Programming,4.7,64 ratings,252525,5,GTx,Computer Science,Introductory,English,15847
MathWorks: MATLAB Essentials,4.4,103 ratings,26244,4,MathWorks,Engineering,Introductory,English,15847
IIMBx: Accounting and Finance,4.5stars,18 ratings,170011,11,IIMBx,Business & Management,Intermediate,English,12600
IBM: Analyzing Data with Python,4.6,97 ratings,157150,5,IBM,Data Analysis & Statistics,Introductory,English,8301
UQx: Academic English: How to Write an Essay,4.7,6 ratings,57714,10,UQx,Communication,Introductory,English,9978
IBM: Visualizing Data with Python,4.5,107 ratings,70270,5,IBM,Data Analysis & Statistics,Intermediate,English,8301
HarvardX: Introduction to Family Engagement in Education,4.8,158 ratings,173334,6,HarvardX,Education & Teacher Training,Introductory,English,None
UMontrealX: Français élémentaire 1,4.2,17 ratings,18394,5,UMontrealX,Language,Introductory,Français,9978
IBM: Hardware and Operating Systems,4.7,82 ratings,11058,6,IBM,Computer Science,Introductory,English,4108
WasedaX: Steps in Japanese for Beginners1 Part1,4.5,18 ratings,125131,5,WasedaX,Language,Introductory,English,4947
TecdeMonterreyX: Liderazgo y comportamiento organizacional,4.6,5 ratings,48993,4,TecdeMonterreyX,Business & Management,Introductory,Español,15847
"SDGAcademyX: The Living Amazon: Science, Cultures and Sustainability in Practice",None,None,5641,8,SDGAcademyX,Environmental Studies,Intermediate,English,None
"DartmouthX, IMTx: C Programming: Getting Started",4.8,17 ratings,182339,5,DartmouthX,Computer Science,Introductory,English,8301
UBCx: Introduction to Marketing,4.7,21 ratings,239384,6,UBCx,Business & Management,Introductory,English,12577
edX: How to Use ChatGPT in Education,4.3stars,95 ratings,11045,1,edX,Computer Science,Intermediate,English,1680
"IBM: Big Data, Hadoop, and Spark Basics",4.5stars,40 ratings,14630,6,IBM,Computer Science,Introductory,English,8316
IUx: Introduction to Personal Financial Planning,4.4,27 ratings,29502,4,IUx,Economics & Finance,Introductory,English,16685
"UMD, USMx: Product Management Fundamentals",4.3,50 ratings,69413,4,UMD,Business & Management,Introductory,English,20878
EC-Council: Ethical Hacking Essentials (EHE),4.6,41 ratings,18186,1,EC-Council,Computer Science,Intermediate,English,10816
IBM: Soft Skills: Develop Interpersonal Skills,4.3stars,51 ratings,6405,1,IBM,Communication,Introductory,English,2436
StanfordOnline: Databases: Advanced Topics in SQL,4.4,7 ratings,41677,2,StanfordOnline,Computer Science,Introductory,English,5785
HarvardX: Energy and Thermodynamics,4.3stars,16 ratings,25419,10,HarvardX,Chemistry,Introductory,English,20916
DelftX: Pre-University Calculus,4.3,15 ratings,146214,8,DelftX,Math,Introductory,English,4192
LinuxFoundationX: Introduction to Cloud Infrastructure Technologies,4.5,17 ratings,130351,14,LinuxFoundationX,Computer Science,Introductory,English,15847
ArmEducationX: Machine Learning at the Edge on Arm: A Practical Introduction,4.6,150 ratings,7831,6,ArmEducationX,Computer Science,Intermediate,English,8301
HarvardX: CS50's Introduction to Programming with R,None,None,6482,7,HarvardX,Computer Science,Introductory,English,25116
StanfordOnline: Statistical Learning with R,4.4,41 ratings,95380,11,StanfordOnline,Data Analysis & Statistics,Introductory,English,15847
GTx: Introduction to Object-Oriented Programming with Java I: Foundations and Syntax Basics,4.2,30 ratings,34355,6,GTx,Computer Science,Introductory,English,20878
TEFLx: 50-hour English Language Teaching Methodology,4.0stars,7 ratings,9105,10,TEFLx,Education & Teacher Training,Intermediate,English,25116
WageningenX: Nutrition and Health: Micronutrients and Malnutrition,4.8,51 ratings,98468,7,WageningenX,Biology & Life Sciences,Intermediate,English,20878
HarvardX: Child Protection: Children's Rights in Theory and Practice,4.8,91 ratings,33707,16,HarvardX,Social Sciences,Introductory,English,12493
"UMD, USMx: Project Management Principles",4.5,53 ratings,12945,5,UMD,Business & Management,Introductory,English,9978
IBM: Visualizing Data with R,4.6,124 ratings,8046,4,IBM,Data Analysis & Statistics,Introductory,English,8301
"HarvardX: U.S. Public Policy: Social, Economic, and Foreign Policies",4.8,67 ratings,84361,4,HarvardX,Social Sciences,Introductory,English,12493
MITx: Genetics: The Fundamentals,None,None,16680,7,MITx,Biology & Life Sciences,Advanced,English,8316
UniversityofCambridge: Financial accounting and capital markets,4.7,27 ratings,21886,5,UniversityofCambridge,Economics & Finance,Intermediate,English,25070
HarvardX: Fat Chance: Probability from the Ground Up,4.6,48 ratings,104478,7,HarvardX,Math,Introductory,English,12493
edX: AI Applications and Prompt Engineering,4.2stars,25 ratings,9503,1,edX,Computer Science,Introductory,English,8316
UPValenciaX: Introduction to the Internet of Things,4.4,74 ratings,17912,6,UPValenciaX,Electronics,Introductory,English,3270
FullbridgeX: Self-Assessment – Developing Your Strengths,4.4,137 ratings,27697,3,FullbridgeX,Business & Management,Introductory,English,None
HarvardX: Fundamentals of TinyML,4.5,55 ratings,63172,5,HarvardX,Data Analysis & Statistics,Introductory,English,25070
StellenboschX: Introduction to Human Resources (HR) leadership and HR management strategies,4.6,114 ratings,15857,2,StellenboschX,Business & Management,Intermediate,English,12493
"HarvardX: Bioethics: The Law, Medicine, and Ethics of Reproductive Technologies and Genetics",4.7,73 ratings,137331,10,HarvardX,Medicine,Introductory,English,18362
IBM: Back-end Application Development with Node.js and Express,4.2,79 ratings,37233,3,IBM,Computer Science,Intermediate,English,4108
DoaneX: Fundamentals of Psychology,4.6,72 ratings,34780,8,DoaneX,Social Sciences,Introductory,English,9978
IIMBx: Digital Marketing Strategy,4.5stars,29 ratings,11580,6,IIMBx,Business & Management,Intermediate,English,15876
SDGAcademyX: Measuring Sustainable Development,4.3,74 ratings,22886,5,SDGAcademyX,Data Analysis & Statistics,Intermediate,English,None
AWS: AWS Cloud Technical Essentials,4.5,37 ratings,24364,4,AWS,Computer Science,Introductory,English,15847
Wharton: Business Strategy from Wharton: Competitive Advantage,4.7,121 ratings,72406,6,Wharton,Business & Management,Intermediate,English,16685
IBM: NoSQL Database Basics,4.4,63 ratings,8947,5,IBM,Computer Science,Introductory,English,8301
"HarvardX: Religion, Conflict and Peace",4.8,81 ratings,125483,8,HarvardX,Humanities,Introductory,English,12493
DoaneX: Medical Terminology,4.5,51 ratings,77601,8,DoaneX,Biology & Life Sciences,Introductory,English,9978
"StanfordOnline: Algorithms: Design and Analysis, Part 1",4.7stars,13 ratings,78450,6,StanfordOnline,Computer Science,Intermediate,English,15876
HarvardX: Electrochemistry,4.4,13 ratings,16109,10,HarvardX,Chemistry,Introductory,English,20878
ArmEducationX: Introduction to Microprocessors,4.4,105 ratings,7013,5,ArmEducationX,Computer Science,Introductory,English,4108
HarvardX: Innovating in Health Care,4.5,55 ratings,104313,9,HarvardX,Business & Management,Intermediate,English,20878
HP: A Complete Guide to Game Design,4.5stars,75 ratings,7759,4,HP,Computer Science,Introductory,English,420
RITx: Teamwork & Collaboration,4.5,41 ratings,18143,3,RITx,Communication,Introductory,English,16685
HarvardX: Data Science: Productivity Tools,4.3,32 ratings,103193,8,HarvardX,Data Analysis & Statistics,Introductory,English,12493
"HarvardX: Prescription Drug Regulation, Cost, and Access: Current Controversies in Context",4.8,42 ratings,115547,8,HarvardX,Medicine,Introductory,English,25070
HarvardX: High-Dimensional Data Analysis,4.4,11 ratings,125111,4,HarvardX,Data Analysis & Statistics,Advanced,English,18362
HarvardX: Christianity Through Its Scriptures,4.6stars,46 ratings,162067,4,HarvardX,Humanities,Introductory,English,12516
NUS: Quantitative and Qualitative Research for Beginners,4.5,51 ratings,23594,8,NUS,Social Sciences,Introductory,English,8301
MandarinX: Mandarin Chinese Level 1,4.6,14 ratings,110461,6,MandarinX,Language,Introductory,English,15847
AnahuacX: Comunicación y Pronunciación en Inglés,4.7,9 ratings,44576,4,AnahuacX,Language,Introductory,Español,3270
HarvardX: Quantitative Methods for Biology,4.7stars,15 ratings,64746,10,HarvardX,Computer Science,Introductory,English,18396
UAMx: Introducción a la Ingeniería del Software,4.6,13 ratings,47231,5,UAMx,Computer Science,Introductory,Español,2432
RITx: Public Speaking,4.5,32 ratings,51512,3,RITx,Communication,Introductory,English,16685
HarvardX: Masterpieces of World Literature,4.7,44 ratings,152374,12,HarvardX,Literature,Introductory,English,25070
